{
  "$schema": "https://json-schema.org/draft/2020-12/schema",
  "title": "SCIR Benchmark Manifest",
  "type": "object",
  "additionalProperties": false,
  "required": [
    "benchmark_id",
    "track",
    "task_family",
    "corpus",
    "corpus_manifest",
    "corpus_manifest_hash",
    "baselines",
    "success_gates",
    "kill_gates"
  ],
  "properties": {
    "benchmark_id": {
      "type": "string",
      "minLength": 1
    },
    "track": {
      "type": "string",
      "enum": [
        "A",
        "B",
        "C",
        "D"
      ]
    },
    "task_family": {
      "type": "string",
      "minLength": 1
    },
    "corpus": {
      "type": "object",
      "additionalProperties": false,
      "required": [
        "name",
        "scope"
      ],
      "properties": {
        "name": {
          "type": "string",
          "minLength": 1
        },
        "scope": {
          "type": "string",
          "minLength": 1
        },
        "hash": {
          "type": "string",
          "pattern": "^sha256:[0-9a-f]{64}$"
        }
      }
    },
    "corpus_manifest": {
      "type": "string",
      "minLength": 1
    },
    "corpus_manifest_hash": {
      "type": "string",
      "pattern": "^sha256:[0-9a-f]{64}$"
    },
    "baselines": {
      "type": "array",
      "minItems": 1,
      "items": {
        "type": "string",
        "minLength": 1
      }
    },
    "profiles": {
      "type": "array",
      "uniqueItems": true,
      "items": {
        "type": "string",
        "enum": [
          "R",
          "N",
          "P",
          "D-PY",
          "D-JS"
        ]
      }
    },
    "success_gates": {
      "type": "array",
      "minItems": 1,
      "items": {
        "type": "string",
        "minLength": 1
      }
    },
    "kill_gates": {
      "type": "array",
      "minItems": 1,
      "items": {
        "type": "string",
        "minLength": 1
      }
    },
    "contamination_controls": {
      "type": "array",
      "items": {
        "type": "string",
        "minLength": 1
      }
    }
  }
}
